=== PBS MERGE TXT START Fri Dec 26 09:26:16 -03 2025 ===
Environment OK: bcftools 1.22
======================================
STR DATA CONSOLIDATION (OUTLIERS FILES)
Started: Fri Dec 26 09:26:16 -03 2025
======================================
Input directory: ../samples/gp_global
Output file: ../samples/gp_global/merged/outliers_consolidated.tsv
Sample summary: ../samples/gp_global/merged/outliers_summary.tsv
Log file: ../samples/gp_global/merged/outliers_merge_log.txt
--------------------------------------
Found 168 outliers files
--------------------------------------
[1/168] Processing BEL-1012-1 from outliers_gp_globalBEL-1012-1.bam.STRs.tsv... OK - 24985 variants
[2/168] Processing BEL-1018-1 from outliers_gp_globalBEL-1018-1.bam.STRs.tsv... OK - 24666 variants
[3/168] Processing BEL-1025-1 from outliers_gp_globalBEL-1025-1.bam.STRs.tsv... OK - 15760 variants
[4/168] Processing BEL-1036-1 from outliers_gp_globalBEL-1036-1.bam.STRs.tsv... OK - 27547 variants
[5/168] Processing BEL-1060-1 from outliers_gp_globalBEL-1060-1.bam.STRs.tsv... OK - 19810 variants
[6/168] Processing BEL-2002-1 from outliers_gp_globalBEL-2002-1.bam.STRs.tsv... OK - 27572 variants
[7/168] Processing BEL-256-1 from outliers_gp_globalBEL-256-1.bam.STRs.tsv... OK - 22718 variants
[8/168] Processing BEL-260-1 from outliers_gp_globalBEL-260-1.bam.STRs.tsv... OK - 29860 variants
[9/168] Processing BEL-331-1 from outliers_gp_globalBEL-331-1.bam.STRs.tsv... OK - 21320 variants
[10/168] Processing BEL-336-1 from outliers_gp_globalBEL-336-1.bam.STRs.tsv... OK - 17972 variants
[11/168] Processing BEL-366-1 from outliers_gp_globalBEL-366-1.bam.STRs.tsv... OK - 20409 variants
[12/168] Processing BEL-808-1 from outliers_gp_globalBEL-808-1.bam.STRs.tsv... OK - 19108 variants
[13/168] Processing BEL-823-1 from outliers_gp_globalBEL-823-1.bam.STRs.tsv... OK - 15964 variants
[14/168] Processing BEL-923-1 from outliers_gp_globalBEL-923-1.bam.STRs.tsv... OK - 22575 variants
[15/168] Processing BEL-933-1 from outliers_gp_globalBEL-933-1.bam.STRs.tsv... OK - 29120 variants
[16/168] Processing BEL-948-1 from outliers_gp_globalBEL-948-1.bam.STRs.tsv... OK - 23105 variants
[17/168] Processing BEL-965-1 from outliers_gp_globalBEL-965-1.bam.STRs.tsv... OK - 6647 variants
[18/168] Processing BEL-982-1 from outliers_gp_globalBEL-982-1.bam.STRs.tsv... OK - 18711 variants
[19/168] Processing BEL-999-1 from outliers_gp_globalBEL-999-1.bam.STRs.tsv... OK - 38204 variants
[20/168] Processing GIG-MT-100-1 from outliers_gp_globalGIG-MT-100-1.bam.STRs.tsv... OK - 20546 variants
[21/168] Processing GIG-MT-11-1 from outliers_gp_globalGIG-MT-11-1.bam.STRs.tsv... OK - 13756 variants
[22/168] Processing GIG-MT-128-1 from outliers_gp_globalGIG-MT-128-1.bam.STRs.tsv... OK - 25175 variants
[23/168] Processing GIG-MT-148-1 from outliers_gp_globalGIG-MT-148-1.bam.STRs.tsv... OK - 21221 variants
[24/168] Processing GIG-MT-159-1 from outliers_gp_globalGIG-MT-159-1.bam.STRs.tsv... OK - 36727 variants
[25/168] Processing GIG-MT-161-1 from outliers_gp_globalGIG-MT-161-1.bam.STRs.tsv... OK - 27756 variants
[26/168] Processing GIG-MT-163-1 from outliers_gp_globalGIG-MT-163-1.bam.STRs.tsv... OK - 25656 variants
[27/168] Processing GIG-MT-164-1 from outliers_gp_globalGIG-MT-164-1.bam.STRs.tsv... OK - 9410 variants
[28/168] Processing GIG-MT-17-1 from outliers_gp_globalGIG-MT-17-1.bam.STRs.tsv... OK - 17623 variants
[29/168] Processing GIG-MT-171-1 from outliers_gp_globalGIG-MT-171-1.bam.STRs.tsv... OK - 19233 variants
[30/168] Processing GIG-MT-176-1 from outliers_gp_globalGIG-MT-176-1.bam.STRs.tsv... OK - 25385 variants
[31/168] Processing GIG-MT-185-1 from outliers_gp_globalGIG-MT-185-1.bam.STRs.tsv... OK - 23857 variants
[32/168] Processing GIG-MT-194-1 from outliers_gp_globalGIG-MT-194-1.bam.STRs.tsv... OK - 19804 variants
[33/168] Processing GIG-MT-216-1 from outliers_gp_globalGIG-MT-216-1.bam.STRs.tsv... OK - 15841 variants
[34/168] Processing GIG-MT-218-1 from outliers_gp_globalGIG-MT-218-1.bam.STRs.tsv... OK - 25312 variants
[35/168] Processing GIG-MT-26-1 from outliers_gp_globalGIG-MT-26-1.bam.STRs.tsv... OK - 19548 variants
[36/168] Processing GIG-MT-27-1 from outliers_gp_globalGIG-MT-27-1.bam.STRs.tsv... OK - 18677 variants
[37/168] Processing GIG-MT-4-1 from outliers_gp_globalGIG-MT-4-1.bam.STRs.tsv... OK - 29188 variants
[38/168] Processing GIG-MT-5-1 from outliers_gp_globalGIG-MT-5-1.bam.STRs.tsv... OK - 10066 variants
[39/168] Processing GIG-MT-72-1 from outliers_gp_globalGIG-MT-72-1.bam.STRs.tsv... OK - 27704 variants
[40/168] Processing GIG-MT-85-1 from outliers_gp_globalGIG-MT-85-1.bam.STRs.tsv... OK - 12660 variants
[41/168] Processing GIG-MT-92-1 from outliers_gp_globalGIG-MT-92-1.bam.STRs.tsv... OK - 30769 variants
[42/168] Processing GIG-RJ-162-1 from outliers_gp_globalGIG-RJ-162-1.bam.STRs.tsv... OK - 24307 variants
[43/168] Processing GIG-RJ-3628-1 from outliers_gp_globalGIG-RJ-3628-1.bam.STRs.tsv... OK - 27343 variants
[44/168] Processing GIG-RJ-3843-1 from outliers_gp_globalGIG-RJ-3843-1.bam.STRs.tsv... OK - 20414 variants
[45/168] Processing GIG-RJ-4242-1 from outliers_gp_globalGIG-RJ-4242-1.bam.STRs.tsv... OK - 12679 variants
[46/168] Processing GIG-RS-15-1 from outliers_gp_globalGIG-RS-15-1.bam.STRs.tsv... OK - 14760 variants
[47/168] Processing GIG-RS-5-1 from outliers_gp_globalGIG-RS-5-1.bam.STRs.tsv... OK - 21692 variants
[48/168] Processing GIG-RS-9-1 from outliers_gp_globalGIG-RS-9-1.bam.STRs.tsv... OK - 12075 variants
[49/168] Processing PNZ-112-1 from outliers_gp_globalPNZ-112-1.bam.STRs.tsv... OK - 21386 variants
[50/168] Processing PNZ-133-1 from outliers_gp_globalPNZ-133-1.bam.STRs.tsv... OK - 23390 variants
[51/168] Processing PNZ-151-1 from outliers_gp_globalPNZ-151-1.bam.STRs.tsv... OK - 15364 variants
[52/168] Processing PNZ-162-1 from outliers_gp_globalPNZ-162-1.bam.STRs.tsv... OK - 29097 variants
[53/168] Processing PNZ-179-1 from outliers_gp_globalPNZ-179-1.bam.STRs.tsv... OK - 11681 variants
[54/168] Processing PNZ-198-1 from outliers_gp_globalPNZ-198-1.bam.STRs.tsv... OK - 16227 variants
[55/168] Processing PNZ-207-1 from outliers_gp_globalPNZ-207-1.bam.STRs.tsv... OK - 15536 variants
[56/168] Processing PNZ-233-1 from outliers_gp_globalPNZ-233-1.bam.STRs.tsv... OK - 5861 variants
[57/168] Processing PNZ-237-1 from outliers_gp_globalPNZ-237-1.bam.STRs.tsv... OK - 11176 variants
[58/168] Processing PNZ-238-1 from outliers_gp_globalPNZ-238-1.bam.STRs.tsv... OK - 16413 variants
[59/168] Processing PNZ-249-1 from outliers_gp_globalPNZ-249-1.bam.STRs.tsv... OK - 18360 variants
[60/168] Processing PNZ-294-1 from outliers_gp_globalPNZ-294-1.bam.STRs.tsv... OK - 22602 variants
[61/168] Processing PNZ-311-1 from outliers_gp_globalPNZ-311-1.bam.STRs.tsv... OK - 21415 variants
[62/168] Processing PNZ-335-1 from outliers_gp_globalPNZ-335-1.bam.STRs.tsv... OK - 21742 variants
[63/168] Processing PNZ-342-1 from outliers_gp_globalPNZ-342-1.bam.STRs.tsv... OK - 9371 variants
[64/168] Processing PNZ-343-1 from outliers_gp_globalPNZ-343-1.bam.STRs.tsv... OK - 17168 variants
[65/168] Processing PNZ-344-1 from outliers_gp_globalPNZ-344-1.bam.STRs.tsv... OK - 14809 variants
[66/168] Processing PNZ-345-1 from outliers_gp_globalPNZ-345-1.bam.STRs.tsv... OK - 5907 variants
[67/168] Processing PNZ-372-1 from outliers_gp_globalPNZ-372-1.bam.STRs.tsv... OK - 12955 variants
[68/168] Processing PNZ-394-1 from outliers_gp_globalPNZ-394-1.bam.STRs.tsv... OK - 13324 variants
[69/168] Processing PNZ-396-1 from outliers_gp_globalPNZ-396-1.bam.STRs.tsv... OK - 7037 variants
[70/168] Processing PNZ-398-1 from outliers_gp_globalPNZ-398-1.bam.STRs.tsv... OK - 25043 variants
[71/168] Processing PNZ-423-1 from outliers_gp_globalPNZ-423-1.bam.STRs.tsv... OK - 13635 variants
[72/168] Processing PNZ-424-1 from outliers_gp_globalPNZ-424-1.bam.STRs.tsv... OK - 12558 variants
[73/168] Processing PNZ-433-1 from outliers_gp_globalPNZ-433-1.bam.STRs.tsv... OK - 13281 variants
[74/168] Processing PNZ-491-1 from outliers_gp_globalPNZ-491-1.bam.STRs.tsv... OK - 6000 variants
[75/168] Processing PNZ-502-1 from outliers_gp_globalPNZ-502-1.bam.STRs.tsv... OK - 16008 variants
[76/168] Processing PNZ-506-1 from outliers_gp_globalPNZ-506-1.bam.STRs.tsv... OK - 8888 variants
[77/168] Processing PNZ-510-1 from outliers_gp_globalPNZ-510-1.bam.STRs.tsv... OK - 18758 variants
[78/168] Processing PNZ-538-1 from outliers_gp_globalPNZ-538-1.bam.STRs.tsv... OK - 12668 variants
[79/168] Processing PNZ-550-1 from outliers_gp_globalPNZ-550-1.bam.STRs.tsv... OK - 22467 variants
[80/168] Processing PNZ-557-1 from outliers_gp_globalPNZ-557-1.bam.STRs.tsv... OK - 18212 variants
[81/168] Processing PNZ-573-1 from outliers_gp_globalPNZ-573-1.bam.STRs.tsv... OK - 18089 variants
[82/168] Processing PNZ-592-1 from outliers_gp_globalPNZ-592-1.bam.STRs.tsv... OK - 14744 variants
[83/168] Processing PNZ-608-1 from outliers_gp_globalPNZ-608-1.bam.STRs.tsv... OK - 22813 variants
[84/168] Processing PNZ-630-1 from outliers_gp_globalPNZ-630-1.bam.STRs.tsv... OK - 18952 variants
[85/168] Processing PNZ-632-1 from outliers_gp_globalPNZ-632-1.bam.STRs.tsv... OK - 14118 variants
[86/168] Processing PNZ-633-1 from outliers_gp_globalPNZ-633-1.bam.STRs.tsv... OK - 13568 variants
[87/168] Processing PNZ-635-1 from outliers_gp_globalPNZ-635-1.bam.STRs.tsv... OK - 24022 variants
[88/168] Processing PNZ-644-1 from outliers_gp_globalPNZ-644-1.bam.STRs.tsv... OK - 13617 variants
[89/168] Processing PNZ-647-1 from outliers_gp_globalPNZ-647-1.bam.STRs.tsv... OK - 16080 variants
[90/168] Processing PNZ-660-1 from outliers_gp_globalPNZ-660-1.bam.STRs.tsv... OK - 19548 variants
[91/168] Processing PNZ-701-1 from outliers_gp_globalPNZ-701-1.bam.STRs.tsv... OK - 15891 variants
[92/168] Processing PNZ-707-1 from outliers_gp_globalPNZ-707-1.bam.STRs.tsv... OK - 15931 variants
[93/168] Processing PNZ-708-1 from outliers_gp_globalPNZ-708-1.bam.STRs.tsv... OK - 19405 variants
[94/168] Processing PNZ-756-1 from outliers_gp_globalPNZ-756-1.bam.STRs.tsv... OK - 20741 variants
[95/168] Processing PNZ-791-1 from outliers_gp_globalPNZ-791-1.bam.STRs.tsv... OK - 22295 variants
[96/168] Processing REC-100-1 from outliers_gp_globalREC-100-1.bam.STRs.tsv... OK - 16090 variants
[97/168] Processing REC-101-1 from outliers_gp_globalREC-101-1.bam.STRs.tsv... OK - 14220 variants
[98/168] Processing REC-102-1 from outliers_gp_globalREC-102-1.bam.STRs.tsv... OK - 16596 variants
[99/168] Processing REC-103-1 from outliers_gp_globalREC-103-1.bam.STRs.tsv... OK - 9257 variants
[100/168] Processing REC-104-1 from outliers_gp_globalREC-104-1.bam.STRs.tsv... OK - 23229 variants
[101/168] Processing REC-105-1 from outliers_gp_globalREC-105-1.bam.STRs.tsv... OK - 20412 variants
[102/168] Processing REC-106-1 from outliers_gp_globalREC-106-1.bam.STRs.tsv... OK - 11215 variants
[103/168] Processing REC-107-1 from outliers_gp_globalREC-107-1.bam.STRs.tsv... OK - 14743 variants
[104/168] Processing REC-108-1 from outliers_gp_globalREC-108-1.bam.STRs.tsv... OK - 10522 variants
[105/168] Processing REC-109-1 from outliers_gp_globalREC-109-1.bam.STRs.tsv... OK - 8375 variants
[106/168] Processing REC-110-1 from outliers_gp_globalREC-110-1.bam.STRs.tsv... OK - 14157 variants
[107/168] Processing REC-111-1 from outliers_gp_globalREC-111-1.bam.STRs.tsv... OK - 19747 variants
[108/168] Processing REC-112-1 from outliers_gp_globalREC-112-1.bam.STRs.tsv... OK - 19473 variants
[109/168] Processing REC-113-1 from outliers_gp_globalREC-113-1.bam.STRs.tsv... OK - 19429 variants
[110/168] Processing REC-114-1 from outliers_gp_globalREC-114-1.bam.STRs.tsv... OK - 17726 variants
[111/168] Processing REC-115-1 from outliers_gp_globalREC-115-1.bam.STRs.tsv... OK - 11923 variants
[112/168] Processing REC-13-1 from outliers_gp_globalREC-13-1.bam.STRs.tsv... OK - 31210 variants
[113/168] Processing REC-16-1 from outliers_gp_globalREC-16-1.bam.STRs.tsv... OK - 21112 variants
[114/168] Processing REC-18-1 from outliers_gp_globalREC-18-1.bam.STRs.tsv... OK - 17796 variants
[115/168] Processing REC-27-1 from outliers_gp_globalREC-27-1.bam.STRs.tsv... OK - 16991 variants
[116/168] Processing REC-30-1 from outliers_gp_globalREC-30-1.bam.STRs.tsv... OK - 20322 variants
[117/168] Processing REC-32-1 from outliers_gp_globalREC-32-1.bam.STRs.tsv... OK - 26076 variants
[118/168] Processing REC-40-1 from outliers_gp_globalREC-40-1.bam.STRs.tsv... OK - 25701 variants
[119/168] Processing REC-44-1 from outliers_gp_globalREC-44-1.bam.STRs.tsv... OK - 27994 variants
[120/168] Processing REC-51-1 from outliers_gp_globalREC-51-1.bam.STRs.tsv... OK - 21859 variants
[121/168] Processing REC-53-1 from outliers_gp_globalREC-53-1.bam.STRs.tsv... OK - 16715 variants
[122/168] Processing REC-54-1 from outliers_gp_globalREC-54-1.bam.STRs.tsv... OK - 41680 variants
[123/168] Processing REC-6-1 from outliers_gp_globalREC-6-1.bam.STRs.tsv... OK - 23686 variants
[124/168] Processing REC-63-1 from outliers_gp_globalREC-63-1.bam.STRs.tsv... OK - 13052 variants
[125/168] Processing REC-65-1 from outliers_gp_globalREC-65-1.bam.STRs.tsv... OK - 17882 variants
[126/168] Processing REC-68-1 from outliers_gp_globalREC-68-1.bam.STRs.tsv... OK - 11914 variants
[127/168] Processing REC-7-1 from outliers_gp_globalREC-7-1.bam.STRs.tsv... OK - 25519 variants
[128/168] Processing REC-73-1 from outliers_gp_globalREC-73-1.bam.STRs.tsv... OK - 29400 variants
[129/168] Processing REC-75-1 from outliers_gp_globalREC-75-1.bam.STRs.tsv... OK - 25323 variants
[130/168] Processing REC-76-1 from outliers_gp_globalREC-76-1.bam.STRs.tsv... OK - 22649 variants
[131/168] Processing REC-77-1 from outliers_gp_globalREC-77-1.bam.STRs.tsv... OK - 21337 variants
[132/168] Processing REC-78-1 from outliers_gp_globalREC-78-1.bam.STRs.tsv... OK - 14226 variants
[133/168] Processing REC-8-1 from outliers_gp_globalREC-8-1.bam.STRs.tsv... OK - 17149 variants
[134/168] Processing REC-83-1 from outliers_gp_globalREC-83-1.bam.STRs.tsv... OK - 22513 variants
[135/168] Processing REC-84-1 from outliers_gp_globalREC-84-1.bam.STRs.tsv... OK - 29990 variants
[136/168] Processing REC-85-1 from outliers_gp_globalREC-85-1.bam.STRs.tsv... OK - 27929 variants
[137/168] Processing REC-86-1 from outliers_gp_globalREC-86-1.bam.STRs.tsv... OK - 31445 variants
[138/168] Processing REC-88-1 from outliers_gp_globalREC-88-1.bam.STRs.tsv... OK - 20124 variants
[139/168] Processing REC-89-1 from outliers_gp_globalREC-89-1.bam.STRs.tsv... OK - 24091 variants
[140/168] Processing REC-90-1 from outliers_gp_globalREC-90-1.bam.STRs.tsv... OK - 14786 variants
[141/168] Processing REC-91-1 from outliers_gp_globalREC-91-1.bam.STRs.tsv... OK - 13312 variants
[142/168] Processing REC-92-1 from outliers_gp_globalREC-92-1.bam.STRs.tsv... OK - 11400 variants
[143/168] Processing REC-93-1 from outliers_gp_globalREC-93-1.bam.STRs.tsv... OK - 19374 variants
[144/168] Processing REC-94-1 from outliers_gp_globalREC-94-1.bam.STRs.tsv... OK - 15336 variants
[145/168] Processing REC-95-1 from outliers_gp_globalREC-95-1.bam.STRs.tsv... OK - 17057 variants
[146/168] Processing REC-96-1 from outliers_gp_globalREC-96-1.bam.STRs.tsv... OK - 17356 variants
[147/168] Processing REC-97-1 from outliers_gp_globalREC-97-1.bam.STRs.tsv... OK - 25550 variants
[148/168] Processing REC-98-1 from outliers_gp_globalREC-98-1.bam.STRs.tsv... OK - 21542 variants
[149/168] Processing REC-99-1 from outliers_gp_globalREC-99-1.bam.STRs.tsv... OK - 29687 variants
[150/168] Processing SSA-2001-1 from outliers_gp_globalSSA-2001-1.bam.STRs.tsv... OK - 29045 variants
[151/168] Processing SSA-2017-1 from outliers_gp_globalSSA-2017-1.bam.STRs.tsv... OK - 19671 variants
[152/168] Processing SSA-2029-1 from outliers_gp_globalSSA-2029-1.bam.STRs.tsv... OK - 28336 variants
[153/168] Processing SSA-2030-1 from outliers_gp_globalSSA-2030-1.bam.STRs.tsv... OK - 21140 variants
[154/168] Processing SSA-2031-1 from outliers_gp_globalSSA-2031-1.bam.STRs.tsv... OK - 17975 variants
[155/168] Processing SSA-2033-1 from outliers_gp_globalSSA-2033-1.bam.STRs.tsv... OK - 18372 variants
[156/168] Processing SSA-2038-1 from outliers_gp_globalSSA-2038-1.bam.STRs.tsv... OK - 16773 variants
[157/168] Processing SSA-2044-1 from outliers_gp_globalSSA-2044-1.bam.STRs.tsv... OK - 20001 variants
[158/168] Processing SSA-2054-1 from outliers_gp_globalSSA-2054-1.bam.STRs.tsv... OK - 31045 variants
[159/168] Processing SSA-2056-1 from outliers_gp_globalSSA-2056-1.bam.STRs.tsv... OK - 27391 variants
[160/168] Processing SSA-2066-1 from outliers_gp_globalSSA-2066-1.bam.STRs.tsv... OK - 23561 variants
[161/168] Processing SSA-2074-1 from outliers_gp_globalSSA-2074-1.bam.STRs.tsv... OK - 26623 variants
[162/168] Processing SSA-2097-1 from outliers_gp_globalSSA-2097-1.bam.STRs.tsv... OK - 33549 variants
[163/168] Processing SSA-2120-1 from outliers_gp_globalSSA-2120-1.bam.STRs.tsv... OK - 33656 variants
[164/168] Processing SSA-2178-1 from outliers_gp_globalSSA-2178-1.bam.STRs.tsv... OK - 35546 variants
[165/168] Processing SSA-2208-1 from outliers_gp_globalSSA-2208-1.bam.STRs.tsv... OK - 10670 variants
[166/168] Processing SSA-2216-1 from outliers_gp_globalSSA-2216-1.bam.STRs.tsv... OK - 25712 variants
[167/168] Processing SSA-945-1 from outliers_gp_globalSSA-945-1.bam.STRs.tsv... OK - 14176 variants
[168/168] Processing UFPE-6-1 from outliers_gp_globalUFPE-6-1.bam.STRs.tsv... OK - 19164 variants
======================================
CONSOLIDATION COMPLETE
======================================
SUMMARY STATISTICS:
  Total samples found: 168
  Successfully processed: 168
  Failed/skipped: 0
  Total variants consolidated: 3333995

  Average variants per sample: 19845

OUTPUT FILES:
  Consolidated TSV: ../samples/gp_global/merged/outliers_consolidated.tsv
    Size: 257M
    Lines: 3333995 variants + 1 header
  Sample summary: ../samples/gp_global/merged/outliers_summary.tsv
    Size: 8.0K
    Lines: 168 samples + 1 header

First 3 lines of consolidated output:
sample	chrom	start	end	repeat_unit	allele1_est	allele2_est	spanning_reads	spanning_pairs	left_clips	right_clips	unplaced_pairs	sum_str_counts	depth	outlier	p	p_adj
BEL-1012-1	18	35064000	35064033	A	-9	155.68	6	32	12	6	0	449	33	27	1.7e-157	1.5e-152
BEL-1012-1	1	69249900	69249901	T	0	112.16	24	20	0	4	0	271	32	25	8.8e-143	3.9e-138
BEL-1012-1	4	41009229	41009230	A	0	113.29	38	26	4	0	0	361	42	25	1e-140	3e-136

First 3 samples in summary:
sample	variant_count	mean_depth	mean_allele_diff	homozygous_count	heterozygous_count
BEL-1012-1	24985	35.51	41.29	16	24969
BEL-1018-1	24666	32.78	43.37	14	24652
BEL-1025-1	15760	25.07	47.66	6	15754

Finished: Fri Dec 26 09:27:10 -03 2025
======================================

Log saved to: ../samples/gp_global/merged/outliers_merge_log.txt
    Size: 257M
    Lines: 3333995 variants + 1 header
  Sample summary: ../samples/gp_global/merged/outliers_summary.tsv
    Size: 8.0K
    Lines: 168 samples + 1 header

First 3 lines of consolidated output:
sample	chrom	start	end	repeat_unit	allele1_est	allele2_est	spanning_reads	spanning_pairs	left_clips	right_clips	unplaced_pairs	sum_str_counts	depth	outlier	p	p_adj
BEL-1012-1	18	35064000	35064033	A	-9	155.68	6	32	12	6	0	449	33	27	1.7e-157	1.5e-152
BEL-1012-1	1	69249900	69249901	T	0	112.16	24	20	0	4	0	271	32	25	8.8e-143	3.9e-138
BEL-1012-1	4	41009229	41009230	A	0	113.29	38	26	4	0	0	361	42	25	1e-140	3e-136

First 3 samples in summary:
sample	variant_count	mean_depth	mean_allele_diff	homozygous_count	heterozygous_count
BEL-1012-1	24985	35.51	41.29	16	24969
BEL-1018-1	24666	32.78	43.37	14	24652
BEL-1025-1	15760	25.07	47.66	6	15754

Finished: Fri Dec 26 09:27:10 -03 2025
======================================
